{
  "meta": {
    "locale": "fr-BE",
    "version": "DRAFT",
    "generatedAt": "2026-07-08T17:29:48.970Z"
  },
  "branding": {},
  "audit": {
    "entity": {
      "name": "Finassura",
      "fsmaStatus": "à confirmer"
    },
    "site": {
      "url": "https://www.finassura.be/",
      "environment": "production"
    },
    "date": "2026-07-08",
    "scope": "Audit du contenu publicitaire et informatif du site tel qu'il se présente. Il ne s'agit pas d'un audit juridique exhaustif des pratiques commerciales, contractuelles ou opérationnelles, ni d'un examen de la documentation précontractuelle.",
    "disclaimer": "Les niveaux de risque sont indicatifs et ne préjugent pas de l'appréciation d'une autorité de contrôle ou d'un juge.",
    "pages": {
      "analysed": [
        "https://www.finassura.be/"
      ],
      "notAnalysed": [
        {
          "page": "http://113475.brokerweb.be/fr/",
          "reason": "fetch failed"
        }
      ]
    }
  },
  "findings": [
    {
      "id": "P01",
      "section": "Identification et page d'accueil",
      "title": "Slogan légal crédit",
      "level": "sans_objet",
      "score": {
        "filled": 0,
        "applicable": 0
      },
      "constat": "Cette sous-section est sans objet au regard du contenu du site.",
      "recommandation": "",
      "legalRefs": [
        "art. VII.64 §2 CDE"
      ],
      "checks": []
    },
    {
      "id": "P02",
      "section": "Identification et page d'accueil",
      "title": "Registre FSMA et lien de vérification",
      "level": "critique",
      "score": {
        "filled": 0,
        "applicable": 3
      },
      "constat": "S'agissant de l'identification réglementaire de l'intermédiaire, il est constaté que la ou les qualité(s) d'intermédiaire ne sont pas mentionnées, que le numéro d'inscription auprès de la FSMA n'est pas indiqué, seul le numéro d'entreprise (BCE) figurant et qu'aucun lien de vérification vers le registre de la FSMA n'est proposé.",
      "recommandation": "L'identification réglementaire de l'intermédiaire est incomplète. Il convient de mentionner la ou les qualité(s) sous laquelle/lesquelles l'intermédiaire exerce (crédit hypothécaire, crédit à la consommation, assurances selon le cas), d'indiquer le numéro d'inscription auprès de la FSMA, lequel doit figurer en complément — et non en substitution — du numéro d'entreprise (BCE) et de faire figurer un lien de vérification renvoyant au registre de la FSMA (www.fsma.be/fr/data-portal).",
      "legalRefs": [
        "art. VII.128 §1 2° CDE",
        "art. XII.6 §1 CDE"
      ],
      "checks": [
        {
          "id": "P02.1",
          "label": "Qualité(s) d'intermédiaire indiquée(s)",
          "verdict": "non_conforme",
          "evidence": "La page principale redirige vers http://113475.brokerweb.be/fr/ sans afficher aucun contenu textuel permettant d'identifier la qualité d'intermédiaire (courtier en assurances, en crédit hypothécaire, en crédit conso, etc.). Aucune occurrence trouvée après recherche.",
          "source": "https://www.finassura.be/",
          "article": "art. VII.128 §1 2° CDE"
        },
        {
          "id": "P02.2",
          "label": "Numéro d'inscription FSMA indiqué",
          "verdict": "non_conforme",
          "evidence": "Aucune occurrence trouvée après recherche. La page ne contient qu'un lien de redirection ('Click here to continue') sans aucun numéro FSMA visible.",
          "source": "https://www.finassura.be/",
          "article": "art. VII.128 §1 2° CDE"
        },
        {
          "id": "P02.3",
          "label": "Lien de vérification vers le data portal FSMA (fsma.be) présent",
          "verdict": "non_conforme",
          "evidence": "Aucune occurrence trouvée après recherche. Aucun lien vers fsma.be n'est présent sur la page.",
          "source": "https://www.finassura.be/",
          "article": "art. XII.6 §1 CDE"
        }
      ]
    },
    {
      "id": "P03",
      "section": "Identification et page d'accueil",
      "title": "Cohérence statut FSMA / activité promue",
      "level": "sans_objet",
      "score": {
        "filled": 0,
        "applicable": 0
      },
      "constat": "Cette sous-section est sans objet au regard du contenu du site.",
      "recommandation": "",
      "legalRefs": [
        "art. I.9 35° CDE",
        "art. VII.161 §1 CDE"
      ],
      "checks": []
    },
    {
      "id": "P04",
      "section": "Crédit hypothécaire et sous-pages",
      "title": "Publicité incitative au regroupement de crédits",
      "level": "sans_objet",
      "score": {
        "filled": 0,
        "applicable": 0
      },
      "constat": "Cette sous-section est sans objet au regard du contenu du site.",
      "recommandation": "",
      "legalRefs": [
        "art. VII.123 §2 3° CDE",
        "art. VII.65 §1 3° CDE"
      ],
      "checks": []
    },
    {
      "id": "P06",
      "section": "Crédit hypothécaire et sous-pages",
      "title": "Exemple représentatif TAEG",
      "level": "sans_objet",
      "score": {
        "filled": 0,
        "applicable": 0
      },
      "constat": "Cette sous-section est sans objet au regard du contenu du site.",
      "recommandation": "",
      "legalRefs": [
        "art. VII.64 §1 CDE",
        "art. VII.124 §1 et §2 CDE"
      ],
      "checks": []
    },
    {
      "id": "P07",
      "section": "Crédit hypothécaire et sous-pages",
      "title": "Prospectus crédit hypothécaire",
      "level": "sans_objet",
      "score": {
        "filled": 0,
        "applicable": 0
      },
      "constat": "Cette sous-section est sans objet au regard du contenu du site.",
      "recommandation": "",
      "legalRefs": [
        "art. VII.125 CDE"
      ],
      "checks": []
    },
    {
      "id": "P08",
      "section": "Crédit hypothécaire et sous-pages",
      "title": "Rapidité / facilité d'obtention",
      "level": "sans_objet",
      "score": {
        "filled": 0,
        "applicable": 0
      },
      "constat": "Cette sous-section est sans objet au regard du contenu du site.",
      "recommandation": "",
      "legalRefs": [
        "art. VII.65 §1 2° CDE",
        "art. VII.123 §2 2° CDE"
      ],
      "checks": []
    },
    {
      "id": "P13",
      "section": "Investissement immobilier",
      "title": "Distinction consommateur / professionnel",
      "level": "sans_objet",
      "score": {
        "filled": 0,
        "applicable": 0
      },
      "constat": "Cette sous-section est sans objet au regard du contenu du site.",
      "recommandation": "",
      "legalRefs": [
        "art. VII.3 §2 2° CDE"
      ],
      "checks": []
    },
    {
      "id": "P14",
      "section": "Investissement immobilier",
      "title": "Risque de requalification fiscale",
      "level": "sans_objet",
      "score": {
        "filled": 0,
        "applicable": 0
      },
      "constat": "Cette sous-section est sans objet au regard du contenu du site.",
      "recommandation": "",
      "legalRefs": [
        "CIR 92 art. 90 1°",
        "art. VI.97 CDE"
      ],
      "checks": []
    },
    {
      "id": "P15",
      "section": "Investissement immobilier",
      "title": "Crédit in fine / bullet : communication des risques",
      "level": "sans_objet",
      "score": {
        "filled": 0,
        "applicable": 0
      },
      "constat": "Cette sous-section est sans objet au regard du contenu du site.",
      "recommandation": "",
      "legalRefs": [
        "art. VI.97 CDE"
      ],
      "checks": []
    },
    {
      "id": "P16",
      "section": "Investissement immobilier",
      "title": "Crédit sans apport : contraintes prudentielles BNB",
      "level": "sans_objet",
      "score": {
        "filled": 0,
        "applicable": 0
      },
      "constat": "Cette sous-section est sans objet au regard du contenu du site.",
      "recommandation": "",
      "legalRefs": [
        "Circulaire NBB_2019_27",
        "art. VI.97 CDE"
      ],
      "checks": []
    },
    {
      "id": "P09",
      "section": "Assurance solde restant dû",
      "title": "Vente groupée / libre choix de l'assureur",
      "level": "sans_objet",
      "score": {
        "filled": 0,
        "applicable": 0
      },
      "constat": "Cette sous-section est sans objet au regard du contenu du site.",
      "recommandation": "",
      "legalRefs": [
        "art. VII.147 §1 CDE"
      ],
      "checks": []
    },
    {
      "id": "P10",
      "section": "Assurance solde restant dû",
      "title": "Qualité d'intermédiaire en assurances et FSMA assurances",
      "level": "critique",
      "score": {
        "filled": 0,
        "applicable": 2
      },
      "constat": "S'agissant de la qualité d'intermédiaire en assurances, il est constaté que la qualité de courtier en assurances n'est pas mentionnée et que le numéro d'inscription FSMA en assurances et son lien de vérification ne figurent pas.",
      "recommandation": "La qualité d'intermédiaire en assurances n'est pas régulièrement indiquée. Il convient de mentionner la qualité de courtier en assurances indépendant, tant sur la page d'assurance que dans le pied de page et d'indiquer le numéro d'inscription auprès de la FSMA en assurances, assorti d'un lien de vérification.",
      "legalRefs": [
        "loi 4 avril 2014, art. 261/262/281"
      ],
      "checks": [
        {
          "id": "P10.1",
          "label": "Qualité de courtier en assurances mentionnée",
          "verdict": "non_conforme",
          "evidence": "La page principale ne contient qu'un lien de redirection ('Click here to continue') sans aucun contenu textuel mentionnant la qualité de courtier en assurances.",
          "source": "https://www.finassura.be/",
          "article": "Loi 4 avril 2014, art. 261/262"
        },
        {
          "id": "P10.2",
          "label": "Numéro d'inscription FSMA assurances + lien de vérification",
          "verdict": "non_conforme",